{
  "entity_counts": [1, 32, 1000, 10000],
  "interval_ns": 100000000,
  "intervals_per_case": [10000, 1000, 30, 12],
  "warmup_runs": 1,
  "repeat_runs": 5,
  "command_period_ns": 500000000,
  "latitude_rad": 0.61,
  "longitude_rad": -1.25,
  "latitude_step_rad": 0.0000001,
  "longitude_step_rad": 0.0000001,
  "initial_heading_rad": 0.2,
  "heading_step_rad": 0.00001,
  "initial_speed_mps": 150.0,
  "initial_altitude_m": 1500.0,
  "heading_a_rad": 1.1,
  "heading_b_rad": 5.2,
  "speed_a_mps": 190.0,
  "speed_b_mps": 110.0,
  "altitude_a_m": 3500.0,
  "altitude_b_m": 900.0
}
